{
  "slug": "phoneme-vowel-space-formants",
  "title": "Every Vowel Is Two Numbers",
  "domain": "linguistics",
  "difficulty": 3,
  "summary": "Drag a point around a plane of two resonant frequencies and it names a vowel. The chart phoneticians draw is that plane, and a tube of air explains it.",
  "prerequisites": [],
  "tags": ["phonetics", "formants", "acoustics", "vowel-space", "resonance"],
  "interaction_pattern": "draw-input",
  "sources": [
    { "title": "Peterson and Barney, Control Methods Used in a Study of the Vowels (JASA, 1952)", "url": "https://doi.org/10.1121/1.1906875" },
    { "title": "Gunnar Fant, Acoustic Theory of Speech Production (1960)", "url": "https://doi.org/10.1515/9783110873429" },
    { "title": "Kenneth Stevens, Acoustic Phonetics (1998) — two-tube models", "url": "https://mitpress.mit.edu/9780262692502/acoustic-phonetics/" }
  ],
  "created_at": "2026-09-19",
  "assertions_count": 13
}
