{
  "slug": "coriolis-deflection",
  "title": "Nothing Pushed It Sideways",
  "domain": "earth-science",
  "difficulty": 3,
  "summary": "Slide a puck across frictionless ice and watch it in two frames at once. From the stars it goes dead straight; from the ground it curves, because the ground turned underneath it.",
  "prerequisites": [],
  "tags": ["coriolis", "rotating-frames", "geophysics", "inertial-oscillation", "latitude", "pseudo-force"],
  "interaction_pattern": "spatial-explore",
  "sources": [
    { "title": "Persson, How do we understand the Coriolis force? (BAMS, 1998)", "url": "https://journals.ametsoc.org/view/journals/bams/79/7/1520-0477_1998_079_1373_hdwutc_2_0_co_2.xml" },
    { "title": "Vallis, Atmospheric and Oceanic Fluid Dynamics, ch. 2: effects of rotation", "url": "https://www.cambridge.org/core/books/atmospheric-and-oceanic-fluid-dynamics/41F3FE6D4CA5A9A91F1CE5C6C0D1B1E9" },
    { "title": "NOAA: inertial oscillations and the inertial period", "url": "https://oceanservice.noaa.gov/education/tutorial_currents/04currents1.html" }
  ],
  "created_at": "2026-09-19",
  "assertions_count": 13
}
