{
  "slug": "evolutionarily-stable-strategy",
  "title": "The Only Thing It Cannot Beat Is A Copy Of Itself",
  "domain": "game-theory",
  "difficulty": 3,
  "summary": "Inject mutants into a settled population and watch one straight line decide their fate: its left end asks whether a rare newcomer can get in, its right end whether it could finish the job.",
  "prerequisites": [],
  "tags": ["evolutionarily-stable-strategy", "hawk-dove", "replicator-dynamic", "nash-equilibrium", "invasion-barrier", "population-games"],
  "interaction_pattern": "perturb-and-observe",
  "sources": [
    { "title": "Maynard Smith and Price, The logic of animal conflict, Nature 246 (1973) 15-18", "url": "https://doi.org/10.1038/246015a0" },
    { "title": "Maynard Smith, Evolution and the Theory of Games, Cambridge University Press 1982", "url": "https://doi.org/10.1017/CBO9780511806292" },
    { "title": "Hofbauer and Sigmund, Evolutionary Games and Population Dynamics, Cambridge University Press 1998", "url": "https://doi.org/10.1017/CBO9781139173179" }
  ],
  "created_at": "2026-09-20",
  "assertions_count": 13
}
